{
  "SPDX-License-Identifier": "AGPL-3.0-or-later",
  "capabilities": {
    "documentation_pages": [
      "docs/3d_gaps.md",
      "docs/API_OVERVIEW.md",
      "docs/APPLICATIONS_AND_MARKET.md",
      "docs/ARCHITECTURE.md",
      "docs/ARCHITECTURE_DECISIONS.md",
      "docs/BENCHMARKS.md",
      "docs/BENCHMARK_FIGURES.md",
      "docs/COMPACT_REACTOR_FINDINGS.md",
      "docs/DOE_ARPA_E_CONVERGENCE_PITCH.md",
      "docs/FUTURE_APPLICATIONS.md",
      "docs/IEC_61508_ROADMAP.md",
      "docs/ITER_SYNTHETIC_DATASET_AND_SURROGATE.md",
      "docs/MAST_COMPLETE_MAGNETIC_ARCHIVE.md",
      "docs/NEURAL_TRANSPORT_TRAINING.md",
      "docs/NEURO_SYMBOLIC_LOGIC_COMPILER_REPORT.md",
      "docs/NUMERICAL_CONTRACTS.md",
      "docs/ONBOARDING.md",
      "docs/PERFORMANCE_METRIC_TAXONOMY.md",
      "docs/PHYSICS_METHODS_COMPLETE.md",
      "docs/PHYSICS_VALIDATION_STATUS.md",
      "docs/PROJECT_OVERVIEW.md",
      "docs/PSI_GATE_ATTRIBUTION.md",
      "docs/RELEASE_READINESS.md",
      "docs/SAFETY_TRACEABILITY_MATRIX.md",
      "docs/SOLVER_TUNING_GUIDE.md",
      "docs/STREAMLIT_DEMO_PLAYBOOK.md",
      "docs/STRESS_CAMPAIGN.md",
      "docs/SURROGATE_UQ_CARDS.md",
      "docs/VALIDATION_AGAINST_ITER.md",
      "docs/VALIDATION_REAL_DIIID_145419.md",
      "docs/blog/first_machine_checkable_safety_proof_for_tokamak_plasma_solver.md",
      "docs/competitive_analysis.md",
      "docs/development/ci_workflows.md",
      "docs/equilibrium/frc_rigid_rotor.md",
      "docs/formal_verification.md",
      "docs/hil_demo.md",
      "docs/notebooks/README.md",
      "docs/physics/faraday_recovery.md",
      "docs/physics/hall_mhd_pulsed.md",
      "docs/physics/mrti.md",
      "docs/physics/pulsed_compression.md",
      "docs/physics/tilt_mode_frc.md",
      "docs/releases/v3.10.0.md",
      "docs/releases/v3.10.1.md",
      "docs/releases/v3.11.0.md",
      "docs/releases/v3.9.10.md",
      "docs/releases/v3.9.11.md",
      "docs/releases/v3.9.7.md",
      "docs/releases/v3.9.8.md",
      "docs/releases/v3.9.9.md",
      "docs/rfc/COMPACT_REACTOR_ENGINEERING_CONSTRAINT_VALIDATION_RFC.md",
      "docs/rfc/DETERMINISTIC_CPU_GPU_SIM_RUNTIME_BENCHMARK_RFC.md",
      "docs/rfc/EU_DEMO_K_DEMO_SYNTHETIC_HOLDOUT_VALIDATION_RFC.md",
      "docs/rfc/GPHY-01_RFC.md",
      "docs/rfc/GPHY-02_RFC.md",
      "docs/rfc/GPHY-03_RFC.md",
      "docs/rfc/GPHY-04_RFC.md",
      "docs/rfc/GPHY-05_RFC.md",
      "docs/rfc/GPHY-06_RFC.md",
      "docs/rfc/LIQUID_METAL_TEMHD_DIVERTOR_VALIDATION_RFC.md",
      "docs/rfc/NSTX_U_SPARC_DIGITAL_TWIN_INGESTION_RFC.md",
      "docs/rfc/SNN_RL_TEARING_MODE_FAULT_BENCHMARK_RFC.md",
      "docs/rfc/STELLARATOR_SNN_STABILITY_CONTROL_VALIDATION_RFC.md",
      "docs/rfc/gyro_swin_turbulence_surrogate_benchmark.md",
      "docs/rfc/heat_ml_magnetic_shadow_benchmark.md",
      "docs/rfc/torax_hybrid_realtime_control_benchmark.md",
      "docs/security/CONTAINER_HARDENING.md",
      "docs/security/FUZZING.md",
      "docs/validation/cfspopcon.md",
      "docs/validation/process.md",
      "docs/validation/rustbca.md"
    ],
    "python_classes": [
      {
        "name": "ADCConfig",
        "path": "src/scpn_fusion/control/hil_sensors.py"
      },
      {
        "name": "AMRPatch",
        "path": "src/scpn_fusion/core/amr_patch.py"
      },
      {
        "name": "ActionChannelRule",
        "path": "src/scpn_fusion/control/shielded_tokamak_env.py"
      },
      {
        "name": "ActionReadout",
        "path": "src/scpn_fusion/scpn/artifact.py"
      },
      {
        "name": "ActionSpec",
        "path": "src/scpn_fusion/scpn/contracts.py"
      },
      {
        "name": "ActuatorChannel",
        "path": "src/scpn_fusion/control/stellarator_control_contracts.py"
      },
      {
        "name": "ActuatorCommand",
        "path": "src/scpn_fusion/control/density_controller.py"
      },
      {
        "name": "ActuatorSet",
        "path": "src/scpn_fusion/control/stellarator_control_contracts.py"
      },
      {
        "name": "AdamOptimizer",
        "path": "src/scpn_fusion/core/_surrogate_utils.py"
      },
      {
        "name": "AdaptiveKnmConfig",
        "path": "src/scpn_fusion/phase/adaptive_knm.py"
      },
      {
        "name": "AdaptiveKnmEngine",
        "path": "src/scpn_fusion/phase/adaptive_knm.py"
      },
      {
        "name": "AdaptiveTimeController",
        "path": "src/scpn_fusion/core/integrated_transport_solver_adaptive.py"
      },
      {
        "name": "AdasChargeStateCoefficients",
        "path": "src/scpn_fusion/core/impurity_transport_contracts.py"
      },
      {
        "name": "AlfvenContinuum",
        "path": "src/scpn_fusion/core/alfven_eigenmodes.py"
      },
      {
        "name": "AlfvenGap",
        "path": "src/scpn_fusion/core/alfven_eigenmodes.py"
      },
      {
        "name": "AlfvenStabilityAnalysis",
        "path": "src/scpn_fusion/core/alfven_eigenmodes.py"
      },
      {
        "name": "AlphaHeating",
        "path": "src/scpn_fusion/control/burn_controller.py"
      },
      {
        "name": "AnalyticEquilibriumSolver",
        "path": "src/scpn_fusion/control/analytic_solver.py"
      },
      {
        "name": "Artifact",
        "path": "src/scpn_fusion/scpn/artifact.py"
      },
      {
        "name": "ArtifactMeta",
        "path": "src/scpn_fusion/scpn/artifact.py"
      },
      {
        "name": "ArtifactValidationError",
        "path": "src/scpn_fusion/scpn/artifact.py"
      },
      {
        "name": "AuroraParityCase",
        "path": "src/scpn_fusion/core/impurity_transport_contracts.py"
      },
      {
        "name": "AuroraParityImpuritySolver",
        "path": "src/scpn_fusion/core/impurity_transport_aurora_parity.py"
      },
      {
        "name": "AuroraStrahlArtifact",
        "path": "src/scpn_fusion/core/impurity_transport_contracts.py"
      },
      {
        "name": "AvalancheResult",
        "path": "src/scpn_fusion/core/plasma_startup.py"
      },
      {
        "name": "AxisBlock",
        "path": "src/scpn_fusion/core/gk_domain_decomposition.py"
      },
      {
        "name": "AxisymmetricTokamakBoundary",
        "path": "src/scpn_fusion/core/vmec_lite.py"
      },
      {
        "name": "BackendTier",
        "path": "src/scpn_fusion/core/_multi_compat.py"
      },
      {
        "name": "BallooningEigenResult",
        "path": "src/scpn_fusion/core/ballooning_solver.py"
      },
      {
        "name": "BallooningEquation",
        "path": "src/scpn_fusion/core/ballooning_solver.py"
      },
      {
        "name": "BallooningResult",
        "path": "src/scpn_fusion/core/stability_mhd.py"
      },
      {
        "name": "BallooningSecondStabilityReference",
        "path": "src/scpn_fusion/core/ballooning_second_stability.py"
      },
      {
        "name": "BallooningStabilityAnalysis",
        "path": "src/scpn_fusion/core/ballooning_solver.py"
      },
      {
        "name": "BlobDetector",
        "path": "src/scpn_fusion/core/blob_transport.py"
      },
      {
        "name": "BlobDynamics",
        "path": "src/scpn_fusion/core/blob_transport.py"
      },
      {
        "name": "BlobEnsemble",
        "path": "src/scpn_fusion/core/blob_transport.py"
      },
      {
        "name": "BlobEvent",
        "path": "src/scpn_fusion/core/blob_transport.py"
      },
      {
        "name": "BlobPopulation",
        "path": "src/scpn_fusion/core/blob_transport.py"
      },
      {
        "name": "BootstrapCurrentEstimate",
        "path": "src/scpn_fusion/control/volt_second_manager.py"
      },
      {
        "name": "BreedingBlanket",
        "path": "src/scpn_fusion/nuclear/blanket_neutronics.py"
      },
      {
        "name": "BurnController",
        "path": "src/scpn_fusion/control/burn_controller.py"
      },
      {
        "name": "BurnPhysicsError",
        "path": "src/scpn_fusion/core/dynamic_burn_model.py"
      },
      {
        "name": "BurnPoint",
        "path": "src/scpn_fusion/control/burn_controller.py"
      },
      {
        "name": "BurnStabilityAnalysis",
        "path": "src/scpn_fusion/control/burn_controller.py"
      },
      {
        "name": "BurnThrough",
        "path": "src/scpn_fusion/core/plasma_startup.py"
      },
      {
        "name": "BurnThroughResult",
        "path": "src/scpn_fusion/core/plasma_startup.py"
      },
      {
        "name": "C2UPositiveHeatingShot",
        "path": "src/scpn_fusion/core/public_frc_reference.py"
      },
      {
        "name": "C2UPositiveHeatingSummary",
        "path": "src/scpn_fusion/core/public_frc_reference.py"
      },
      {
        "name": "CADLoadReport",
        "path": "src/scpn_fusion/engineering/cad_raytrace.py"
      },
      {
        "name": "CGYROSolver",
        "path": "src/scpn_fusion/core/gk_cgyro.py"
      },
      {
        "name": "CODACConfig",
        "path": "src/scpn_fusion/control/codac_interface.py"
      },
      {
        "name": "CODACInterface",
        "path": "src/scpn_fusion/control/codac_interface.py"
      },
      {
        "name": "CQResult",
        "path": "src/scpn_fusion/core/disruption_sequence.py"
      },
      {
        "name": "CaseMapping",
        "path": "src/scpn_fusion/core/physical_case.py"
      },
      {
        "name": "ChainResult",
        "path": "src/scpn_fusion/core/locked_mode.py"
      },
      {
        "name": "ChirikovOverlap",
        "path": "src/scpn_fusion/core/tearing_mode_coupling.py"
      },
      {
        "name": "Coil",
        "path": "src/scpn_fusion/core/config_schema.py"
      },
      {
        "name": "CoilCircuitState",
        "path": "src/scpn_fusion/core/pulsed_compression.py"
      },
      {
        "name": "CoilCurrentOffsetCommand",
        "path": "src/scpn_fusion/control/tokamak_flight_sim.py"
      },
      {
        "name": "CoilGeometry",
        "path": "src/scpn_fusion/core/pulsed_compression.py"
      },
      {
        "name": "CoilSet",
        "path": "src/scpn_fusion/control/shape_controller.py"